{
  "format": "moliya-export",
  "formatVersion": 1,
  "app": {
    "name": "Jaybi",
    "version": "0.0.0-test",
    "commit": "test"
  },
  "schemaVersion": 4,
  "exportedAt": "2027-02-01T08:30:00.000Z",
  "exportedBy": {
    "id": "a8d8525b-009e-4bef-8014-94805d499726",
    "email": "admin@ledger.test"
  },
  "vault": {
    "name": "Ledger Two",
    "currency": "USD",
    "createdAt": "2026-09-29T08:57:57.997Z"
  },
  "scope": {
    "from": null,
    "to": null,
    "groupId": null,
    "groupName": null,
    "includesAudit": true,
    "includesReceipts": false,
    "auditFirstSeq": 1,
    "auditLastSeq": 22
  },
  "currencies": [
    {"code":"EUR","minorUnit":2},
    {"code":"RUB","minorUnit":2},
    {"code":"USD","minorUnit":2},
    {"code":"UZS","minorUnit":2}
  ],
  "groups": [
    {"id":1,"name":"Ledger Two","createdAt":"2026-09-29 08:57:57"},
    {"id":2,"name":"Side Business","createdAt":"2026-09-29 08:57:57"}
  ],
  "users": [
    {"id":"a8d8525b-009e-4bef-8014-94805d499726","email":"admin@ledger.test","role":"Admin","groupId":null,"createdAt":"2026-09-29 08:57:57"},
    {"id":"f5484dde-1f98-4f87-adcf-6340c91f6281","email":"manager@ledger.test","role":"Manager","groupId":1,"createdAt":"2026-09-29 08:57:58"},
    {"id":"ecff1779-1f97-4df4-9d25-a9a611695134","email":"viewer@ledger.test","role":"Viewer","groupId":1,"createdAt":"2026-09-29 08:57:58"}
  ],
  "categories": [
    {"id":1,"type":"INCOME","icon":"banknote","names":{"en":"Salary","uz-Latn":"Maosh","uz-Cyrl":"Маош","ru":"Зарплата"}},
    {"id":2,"type":"INCOME","icon":"laptop","names":{"en":"Freelance","uz-Latn":"Frilanserlik","uz-Cyrl":"Фрилансерлик","ru":"Фриланс"}},
    {"id":3,"type":"INCOME","icon":"trending-up","names":{"en":"Investment","uz-Latn":"Investitsiya","uz-Cyrl":"Инвестиция","ru":"Инвестиции"}},
    {"id":4,"type":"INCOME","icon":"gift","names":{"en":"Gift","uz-Latn":"Sovgʻa","uz-Cyrl":"Совға","ru":"Подарок"}},
    {"id":5,"type":"INCOME","icon":"circle","names":{"en":"Other income","uz-Latn":"Boshqa daromad","uz-Cyrl":"Бошқа даромад","ru":"Прочий доход"}},
    {"id":6,"type":"EXPENSE","icon":"utensils","names":{"en":"Food","uz-Latn":"Oziq-ovqat","uz-Cyrl":"Озиқ-овқат","ru":"Еда"}},
    {"id":7,"type":"EXPENSE","icon":"bus","names":{"en":"Transport","uz-Latn":"Transport","uz-Cyrl":"Транспорт","ru":"Транспорт"}},
    {"id":8,"type":"EXPENSE","icon":"home","names":{"en":"Housing","uz-Latn":"Uy-joy","uz-Cyrl":"Уй-жой","ru":"Жильё"}},
    {"id":9,"type":"EXPENSE","icon":"zap","names":{"en":"Utilities","uz-Latn":"Kommunal","uz-Cyrl":"Коммунал","ru":"Коммунальные"}},
    {"id":10,"type":"EXPENSE","icon":"heart","names":{"en":"Health","uz-Latn":"Sogʻliq","uz-Cyrl":"Соғлиқ","ru":"Здоровье"}},
    {"id":11,"type":"EXPENSE","icon":"graduation-cap","names":{"en":"Education","uz-Latn":"Taʼlim","uz-Cyrl":"Таълим","ru":"Образование"}},
    {"id":12,"type":"EXPENSE","icon":"clapperboard","names":{"en":"Entertainment","uz-Latn":"Koʻngilochar","uz-Cyrl":"Кўнгилочар","ru":"Развлечения"}},
    {"id":13,"type":"EXPENSE","icon":"shopping-bag","names":{"en":"Shopping","uz-Latn":"Xaridlar","uz-Cyrl":"Харидлар","ru":"Покупки"}},
    {"id":14,"type":"EXPENSE","icon":"circle","names":{"en":"Other expense","uz-Latn":"Boshqa xarajat","uz-Cyrl":"Бошқа харажат","ru":"Прочий расход"}},
    {"id":15,"type":"EXPENSE","icon":"circle","names":{"en":"Subscriptions","uz-Latn":"Obunalar","uz-Cyrl":"Обуналар","ru":"Подписки"}}
  ],
  "transactions": [
    {"id":"43f4a146-43ce-433a-bb75-13c29c5d22a5","date":"2026-10-01","type":"INCOME","amountMinor":420000,"amount":"4200.00","currency":"USD","categoryId":1,"groupId":1,"userId":"a8d8525b-009e-4bef-8014-94805d499726","notes":"October salary","hasReceipt":false,"receipt":null,"createdAt":"2026-09-29T08:57:58.098Z","updatedAt":"2026-09-29T08:57:58.098Z"},
    {"id":"21f05c1d-7093-48d0-8f37-f9882b04f761","date":"2026-10-02","type":"EXPENSE","amountMinor":10,"amount":"0.10","currency":"USD","categoryId":6,"groupId":1,"userId":"a8d8525b-009e-4bef-8014-94805d499726","notes":null,"hasReceipt":false,"receipt":null,"createdAt":"2026-09-29T08:57:58.099Z","updatedAt":"2026-09-29T08:57:58.099Z"},
    {"id":"ba425adf-dca7-4c53-ae6d-ee41e4be7e63","date":"2026-10-02","type":"EXPENSE","amountMinor":20,"amount":"0.20","currency":"USD","categoryId":6,"groupId":1,"userId":"a8d8525b-009e-4bef-8014-94805d499726","notes":"comma decimal separator","hasReceipt":false,"receipt":null,"createdAt":"2026-09-29T08:57:58.099Z","updatedAt":"2026-09-29T08:57:58.099Z"},
    {"id":"6a6f4ab7-f52d-4a76-931c-9fbf31a01e2c","date":"2026-10-15","type":"EXPENSE","amountMinor":123456,"amount":"1234.56","currency":"USD","categoryId":7,"groupId":2,"userId":"a8d8525b-009e-4bef-8014-94805d499726","notes":"Grouped digits\nsecond line","hasReceipt":false,"receipt":null,"createdAt":"2026-09-29T08:57:58.100Z","updatedAt":"2026-09-29T08:57:58.100Z"},
    {"id":"110b74ba-928b-41cb-859f-172b5bb14006","date":"2026-11-01","type":"INCOME","amountMinor":250000000,"amount":"2500000.00","currency":"UZS","categoryId":2,"groupId":1,"userId":"a8d8525b-009e-4bef-8014-94805d499726","notes":"Oʻzbekcha izoh — Ўзбекча","hasReceipt":false,"receipt":null,"createdAt":"2026-09-29T08:57:58.100Z","updatedAt":"2026-09-29T08:57:58.100Z"},
    {"id":"b74b7a4b-4447-4052-97a5-0dab72bce1fc","date":"2026-11-02","type":"EXPENSE","amountMinor":9999,"amount":"99.99","currency":"EUR","categoryId":13,"groupId":1,"userId":"a8d8525b-009e-4bef-8014-94805d499726","notes":null,"hasReceipt":false,"receipt":null,"createdAt":"2026-09-29T08:57:58.100Z","updatedAt":"2026-09-29T08:57:58.100Z"},
    {"id":"b410ee98-2530-4657-ba65-9b1d09dfc93e","date":"2026-11-03","type":"EXPENSE","amountMinor":267,"amount":"2.67","currency":"USD","categoryId":10,"groupId":1,"userId":"a8d8525b-009e-4bef-8014-94805d499726","notes":"with receipt","hasReceipt":true,"receipt":null,"createdAt":"2026-09-29T08:57:58.101Z","updatedAt":"2026-09-29T08:57:58.101Z"},
    {"id":"adb9be22-b265-41d1-867d-55eff22aa3b2","date":"2026-12-01","type":"INCOME","amountMinor":1,"amount":"0.01","currency":"USD","categoryId":5,"groupId":1,"userId":"a8d8525b-009e-4bef-8014-94805d499726","notes":null,"hasReceipt":false,"receipt":null,"createdAt":"2026-09-29T08:57:58.101Z","updatedAt":"2026-09-29T08:57:58.101Z"},
    {"id":"60725c67-a556-4e04-a2be-c980b6da2a70","date":"2026-12-02","type":"EXPENSE","amountMinor":1500,"amount":"15.00","currency":"USD","categoryId":15,"groupId":1,"userId":"a8d8525b-009e-4bef-8014-94805d499726","notes":"@SUM(1+1) csv trap","hasReceipt":false,"receipt":null,"createdAt":"2026-09-29T08:57:58.101Z","updatedAt":"2026-09-29T08:57:58.101Z"},
    {"id":"9cd0b0e9-7440-42f6-adbc-5680af9becd3","date":"2026-12-03","type":"EXPENSE","amountMinor":1050,"amount":"10.50","currency":"USD","categoryId":9,"groupId":1,"userId":"a8d8525b-009e-4bef-8014-94805d499726","notes":"updated from 10 to 10.50","hasReceipt":false,"receipt":null,"createdAt":"2026-09-29T08:57:58.102Z","updatedAt":"2026-09-29T08:57:58.102Z"},
    {"id":"6f7dd418-5f88-4e61-b779-ca9584a13092","date":"2026-12-04","type":"EXPENSE","amountMinor":1234,"amount":"12.34","currency":"USD","categoryId":6,"groupId":1,"userId":"f5484dde-1f98-4f87-adcf-6340c91f6281","notes":"added by manager","hasReceipt":false,"receipt":null,"createdAt":"2026-09-29T08:57:58.152Z","updatedAt":"2026-09-29T08:57:58.152Z"},
    {"id":"e9ab1cde-cd03-4010-a021-bc931cd3216c","date":"2027-01-05","type":"INCOME","amountMinor":999999999999999,"amount":"9999999999999.99","currency":"USD","categoryId":3,"groupId":1,"userId":"a8d8525b-009e-4bef-8014-94805d499726","notes":"largest accepted amount","hasReceipt":false,"receipt":null,"createdAt":"2026-09-29T08:57:58.202Z","updatedAt":"2026-09-29T08:57:58.202Z"}
  ],
  "totals": [
    {"currency":"USD","incomeMinor":1000000000420000,"expenseMinor":127537,"netMinor":1000000000292463},
    {"currency":"EUR","incomeMinor":0,"expenseMinor":9999,"netMinor":-9999},
    {"currency":"UZS","incomeMinor":250000000,"expenseMinor":0,"netMinor":250000000}
  ],
  "auditLog": [
    {"seq":1,"id":"e1c66ee7-809a-4505-82b8-ab4415722d04","actorId":"a8d8525b-009e-4bef-8014-94805d499726","action":"VAULT_CREATED","entityType":"vault","entityId":"primary","details":"{\"email\":\"admin@ledger.test\",\"appVersion\":\"1.1.0\"}","createdAt":"2026-09-29T08:57:57.998Z","prevHash":"0000000000000000000000000000000000000000000000000000000000000000","hash":"1bc3bd47ca5cb35d2a7285212ab700f2735dcc50b376e0c8dca0519bddd0a94c"},
    {"seq":2,"id":"802120b2-a237-484c-9c2f-b559c6f47545","actorId":"a8d8525b-009e-4bef-8014-94805d499726","action":"GROUP_CREATED","entityType":"group","entityId":"2","details":"{\"name\":\"Side Business\"}","createdAt":"2026-09-29T08:57:57.999Z","prevHash":"1bc3bd47ca5cb35d2a7285212ab700f2735dcc50b376e0c8dca0519bddd0a94c","hash":"ee4876b438ab420b492f98104a1d3815c17a72dc7a7f1cba8786acda91449b3d"},
    {"seq":3,"id":"60a1ed65-d5c9-4997-a267-89a1ab1b6eac","actorId":"a8d8525b-009e-4bef-8014-94805d499726","action":"CATEGORY_CREATED","entityType":"category","entityId":"15","details":"{\"name\":\"Subscriptions\",\"type\":\"EXPENSE\"}","createdAt":"2026-09-29T08:57:57.999Z","prevHash":"ee4876b438ab420b492f98104a1d3815c17a72dc7a7f1cba8786acda91449b3d","hash":"4293e29dbdaf9fc68da2bbbc877dc40f5079ae611fcc1cc5dff3b84333f9c558"},
    {"seq":4,"id":"af6abc0a-5a85-4453-a895-7d6e4f72e985","actorId":"a8d8525b-009e-4bef-8014-94805d499726","action":"USER_CREATED","entityType":"user","entityId":"f5484dde-1f98-4f87-adcf-6340c91f6281","details":"{\"email\":\"manager@ledger.test\",\"role\":\"Manager\",\"groupId\":1}","createdAt":"2026-09-29T08:57:58.049Z","prevHash":"4293e29dbdaf9fc68da2bbbc877dc40f5079ae611fcc1cc5dff3b84333f9c558","hash":"caebe2a2c4ec888435263ae2683708e1acb39c971f72d445aa92ae962824fbe9"},